{
    "contract_version":  "governance-exam.v1",
    "attempt_id":  "EX-20260714-PLATFORM-REGISTRY-DISPATCH-R1-1",
    "record_id":  "IR-20260714-PLATFORM-REGISTRY-DISPATCH-R1",
    "actor":  "Platform registry dispatch agent",
    "attempt_number":  1,
    "status":  "passed",
    "generated_at":  "2026-07-13T22:04:48.0153938Z",
    "completed_at":  "2026-07-13T22:04:54.4453920Z",
    "question_count":  8,
    "passing_score":  100,
    "score":  100,
    "bank_sha256":  "215f1c73ed04453d8c58d9e066e915641df31615cfe449b4ec5dd273f0f94f40",
    "reading_list_sha256":  "fa36c97f81600087475aaf04194ae4ca0e44f2e67067d43d8dd6149ce6135637",
    "checklist_path":  "contracts/foundation/development-checklists/2026-07-14-platform-registry-dispatch-r1.json",
    "checklist_sha256":  "3c2d73899bd67e3dfe87f94bece1e2c787edaba512692c9084a9c2c1a53f5ea6",
    "responses":  [
                      {
                          "question_id":  "GQ-001",
                          "selected_option":  "B",
                          "correct":  true,
                          "source_path":  "CONSTRAINTS.md"
                      },
                      {
                          "question_id":  "GQ-006",
                          "selected_option":  "C",
                          "correct":  true,
                          "source_path":  "docs/project-management/ai-coding-incident-lessons-2026-07-10.md"
                      },
                      {
                          "question_id":  "GQ-002",
                          "selected_option":  "C",
                          "correct":  true,
                          "source_path":  "docs/decisions/0008-versioned-business-variables.md"
                      },
                      {
                          "question_id":  "GQ-012",
                          "selected_option":  "B",
                          "correct":  true,
                          "source_path":  "contracts/foundation/agent-collaboration.v1.json"
                      },
                      {
                          "question_id":  "GQ-015",
                          "selected_option":  "B",
                          "correct":  true,
                          "source_path":  "contracts/foundation/engineering-standards.v1.json"
                      },
                      {
                          "question_id":  "GQ-009",
                          "selected_option":  "B",
                          "correct":  true,
                          "source_path":  "docs/decisions/0010-ai-implementation-records-required.md"
                      },
                      {
                          "question_id":  "GQ-005",
                          "selected_option":  "B",
                          "correct":  true,
                          "source_path":  "docs/decisions/0015-isolated-agent-work-and-controlled-integration.md"
                      },
                      {
                          "question_id":  "GQ-014",
                          "selected_option":  "C",
                          "correct":  true,
                          "source_path":  "contracts/foundation/recurring-issues.v1.json"
                      }
                  ],
    "remediation_sources":  [

                            ]
}
