{
    "contract_version":  "governance-exam.v1",
    "attempt_id":  "EX-20260715-PLATFORM-REGISTRY-DISPATCH-R1-R12G-S2-1",
    "record_id":  "IR-20260715-PLATFORM-REGISTRY-DISPATCH-R1-R12G-S2",
    "actor":  "Platform registry dispatch agent",
    "attempt_number":  1,
    "status":  "passed",
    "generated_at":  "2026-07-14T23:41:11.3260849Z",
    "completed_at":  "2026-07-14T23:41:17.3520586Z",
    "question_count":  8,
    "passing_score":  100,
    "score":  100,
    "bank_sha256":  "215f1c73ed04453d8c58d9e066e915641df31615cfe449b4ec5dd273f0f94f40",
    "reading_list_sha256":  "6f83e140d1e55fe35d1520c13eed55717a812bb21464c59441947c05d7f3b9a6",
    "checklist_path":  "contracts/foundation/development-checklists/2026-07-15-platform-registry-dispatch-r1-r12g-s2.json",
    "checklist_sha256":  "5758e83e4226f1fb3fc8614072c1459e11e7a36d69d25c16669e568010395b5c",
    "responses":  [
                      {
                          "question_id":  "GQ-004",
                          "selected_option":  "B",
                          "correct":  true,
                          "source_path":  "docs/decisions/0016-ai-agent-authority-and-untrusted-context.md"
                      },
                      {
                          "question_id":  "GQ-014",
                          "selected_option":  "C",
                          "correct":  true,
                          "source_path":  "contracts/foundation/recurring-issues.v1.json"
                      },
                      {
                          "question_id":  "GQ-011",
                          "selected_option":  "B",
                          "correct":  true,
                          "source_path":  "docs/project-management/module-internal-dependency-standard-v1.md"
                      },
                      {
                          "question_id":  "GQ-007",
                          "selected_option":  "A",
                          "correct":  true,
                          "source_path":  "AGENTS.md"
                      },
                      {
                          "question_id":  "GQ-010",
                          "selected_option":  "C",
                          "correct":  true,
                          "source_path":  "docs/decisions/0012-two-strike-root-cause-rule.md"
                      },
                      {
                          "question_id":  "GQ-001",
                          "selected_option":  "B",
                          "correct":  true,
                          "source_path":  "CONSTRAINTS.md"
                      },
                      {
                          "question_id":  "GQ-015",
                          "selected_option":  "B",
                          "correct":  true,
                          "source_path":  "contracts/foundation/engineering-standards.v1.json"
                      },
                      {
                          "question_id":  "GQ-008",
                          "selected_option":  "B",
                          "correct":  true,
                          "source_path":  "docs/decisions/0007-stable-foundation-variable-business.md"
                      }
                  ],
    "remediation_sources":  [

                            ]
}
