{
    "contract_version":  "governance-exam.v1",
    "attempt_id":  "EX-20260712-HEALTH-M1-PROFESSIONAL-SIGNOFF-THREE-DECISIONS-R4-1",
    "record_id":  "IR-20260712-HEALTH-M1-PROFESSIONAL-SIGNOFF-THREE-DECISIONS-R4",
    "actor":  "Health professional signoff coordinator",
    "attempt_number":  1,
    "status":  "passed",
    "generated_at":  "2026-07-12T07:21:35.7587134Z",
    "completed_at":  "2026-07-12T07:21:43.0064141Z",
    "question_count":  8,
    "passing_score":  100,
    "score":  100,
    "bank_sha256":  "215f1c73ed04453d8c58d9e066e915641df31615cfe449b4ec5dd273f0f94f40",
    "reading_list_sha256":  "a5db9ef44414b457d8bec993538b1023800ed36bca7cd70c07ba64025fe243ac",
    "checklist_path":  "contracts/modules/health-manager/development-checklists/2026-07-12-health-m1-professional-signoff-three-decisions-r4.json",
    "checklist_sha256":  "4d4090099f020a45eb11e7ca4debbd8bcaf53cf15419f0777cfe48c534f397ed",
    "responses":  [
                      {
                          "question_id":  "GQ-014",
                          "selected_option":  "C",
                          "correct":  true,
                          "source_path":  "contracts/foundation/recurring-issues.v1.json"
                      },
                      {
                          "question_id":  "GQ-001",
                          "selected_option":  "B",
                          "correct":  true,
                          "source_path":  "CONSTRAINTS.md"
                      },
                      {
                          "question_id":  "GQ-006",
                          "selected_option":  "C",
                          "correct":  true,
                          "source_path":  "docs/project-management/ai-coding-incident-lessons-2026-07-10.md"
                      },
                      {
                          "question_id":  "GQ-004",
                          "selected_option":  "B",
                          "correct":  true,
                          "source_path":  "docs/decisions/0016-ai-agent-authority-and-untrusted-context.md"
                      },
                      {
                          "question_id":  "GQ-010",
                          "selected_option":  "C",
                          "correct":  true,
                          "source_path":  "docs/decisions/0012-two-strike-root-cause-rule.md"
                      },
                      {
                          "question_id":  "GQ-007",
                          "selected_option":  "A",
                          "correct":  true,
                          "source_path":  "AGENTS.md"
                      },
                      {
                          "question_id":  "GQ-002",
                          "selected_option":  "C",
                          "correct":  true,
                          "source_path":  "docs/decisions/0008-versioned-business-variables.md"
                      },
                      {
                          "question_id":  "GQ-011",
                          "selected_option":  "B",
                          "correct":  true,
                          "source_path":  "docs/project-management/module-internal-dependency-standard-v1.md"
                      }
                  ],
    "remediation_sources":  [

                            ]
}
