{
    "contract_version":  "governance-exam.v1",
    "attempt_id":  "EX-20260715-PLATFORM-REGISTRY-DISPATCH-R1-R12D-R2-1",
    "record_id":  "IR-20260715-PLATFORM-REGISTRY-DISPATCH-R1-R12D-R2",
    "actor":  "Platform registry dispatch agent",
    "attempt_number":  1,
    "status":  "passed",
    "generated_at":  "2026-07-14T22:19:07.0735325Z",
    "completed_at":  "2026-07-14T22:19:11.7747763Z",
    "question_count":  8,
    "passing_score":  100,
    "score":  100,
    "bank_sha256":  "215f1c73ed04453d8c58d9e066e915641df31615cfe449b4ec5dd273f0f94f40",
    "reading_list_sha256":  "6f83e140d1e55fe35d1520c13eed55717a812bb21464c59441947c05d7f3b9a6",
    "checklist_path":  "contracts/foundation/development-checklists/2026-07-15-platform-registry-dispatch-r1-r12d-r2.json",
    "checklist_sha256":  "71ff665ae3368b1d38fc5108b54614d088c22e7d75d7c33b9ba93a5c2759a013",
    "responses":  [
                      {
                          "question_id":  "GQ-006",
                          "selected_option":  "C",
                          "correct":  true,
                          "source_path":  "docs/project-management/ai-coding-incident-lessons-2026-07-10.md"
                      },
                      {
                          "question_id":  "GQ-007",
                          "selected_option":  "A",
                          "correct":  true,
                          "source_path":  "AGENTS.md"
                      },
                      {
                          "question_id":  "GQ-010",
                          "selected_option":  "C",
                          "correct":  true,
                          "source_path":  "docs/decisions/0012-two-strike-root-cause-rule.md"
                      },
                      {
                          "question_id":  "GQ-001",
                          "selected_option":  "B",
                          "correct":  true,
                          "source_path":  "CONSTRAINTS.md"
                      },
                      {
                          "question_id":  "GQ-016",
                          "selected_option":  "B",
                          "correct":  true,
                          "source_path":  "docs/decisions/0013-mandatory-ai-development-entrypoint.md"
                      },
                      {
                          "question_id":  "GQ-012",
                          "selected_option":  "B",
                          "correct":  true,
                          "source_path":  "contracts/foundation/agent-collaboration.v1.json"
                      },
                      {
                          "question_id":  "GQ-015",
                          "selected_option":  "B",
                          "correct":  true,
                          "source_path":  "contracts/foundation/engineering-standards.v1.json"
                      },
                      {
                          "question_id":  "GQ-003",
                          "selected_option":  "B",
                          "correct":  true,
                          "source_path":  "docs/decisions/0011-two-person-config-approval.md"
                      }
                  ],
    "remediation_sources":  [

                            ]
}
