{
    "contract_version":  "governance-exam.v1",
    "attempt_id":  "EX-20260717-PLATFORM-PDCAR-SKILL-ENFORCEMENT-ACTIVATION-C1-1",
    "record_id":  "IR-20260717-PLATFORM-PDCAR-SKILL-ENFORCEMENT-ACTIVATION-C1",
    "actor":  "APP PDCAR enforcement activation owner",
    "attempt_number":  1,
    "status":  "passed",
    "generated_at":  "2026-07-17T02:30:11.3416196Z",
    "completed_at":  "2026-07-17T02:30:26.1522641Z",
    "question_count":  8,
    "passing_score":  100,
    "score":  100,
    "bank_sha256":  "215f1c73ed04453d8c58d9e066e915641df31615cfe449b4ec5dd273f0f94f40",
    "reading_list_sha256":  "b0df386a68e8e00a803a08d0b3e786893a47bad6742dd36a5b6273803b7abcb1",
    "checklist_path":  "contracts/foundation/development-checklists/2026-07-17-platform-pdcar-skill-enforcement-activation.json",
    "checklist_sha256":  "ad9a593ff5f33acd8e8f4623174ba25d76566ef1e8cef7eca7939952ff9e670f",
    "responses":  [
                      {
                          "question_id":  "GQ-004",
                          "selected_option":  "B",
                          "correct":  true,
                          "source_path":  "docs/decisions/0016-ai-agent-authority-and-untrusted-context.md"
                      },
                      {
                          "question_id":  "GQ-011",
                          "selected_option":  "B",
                          "correct":  true,
                          "source_path":  "docs/project-management/module-internal-dependency-standard-v1.md"
                      },
                      {
                          "question_id":  "GQ-010",
                          "selected_option":  "C",
                          "correct":  true,
                          "source_path":  "docs/decisions/0012-two-strike-root-cause-rule.md"
                      },
                      {
                          "question_id":  "GQ-015",
                          "selected_option":  "B",
                          "correct":  true,
                          "source_path":  "contracts/foundation/engineering-standards.v1.json"
                      },
                      {
                          "question_id":  "GQ-006",
                          "selected_option":  "C",
                          "correct":  true,
                          "source_path":  "docs/project-management/ai-coding-incident-lessons-2026-07-10.md"
                      },
                      {
                          "question_id":  "GQ-012",
                          "selected_option":  "B",
                          "correct":  true,
                          "source_path":  "contracts/foundation/agent-collaboration.v1.json"
                      },
                      {
                          "question_id":  "GQ-008",
                          "selected_option":  "B",
                          "correct":  true,
                          "source_path":  "docs/decisions/0007-stable-foundation-variable-business.md"
                      },
                      {
                          "question_id":  "GQ-013",
                          "selected_option":  "B",
                          "correct":  true,
                          "source_path":  "docs/decisions/0014-ai-development-flight-checklist.md"
                      }
                  ],
    "remediation_sources":  [

                            ]
}
