{
    "contract_version":  "governance-exam.v1",
    "attempt_id":  "EX-20260711-LIFE-APPLICATION-HISTORY-1",
    "record_id":  "IR-20260711-LIFE-APPLICATION-HISTORY",
    "actor":  "Life Navigation 2 module agent",
    "attempt_number":  1,
    "status":  "passed",
    "generated_at":  "2026-07-10T16:18:41.2362842Z",
    "completed_at":  "2026-07-10T16:18:46.9704508Z",
    "question_count":  8,
    "passing_score":  100,
    "score":  100,
    "bank_sha256":  "215f1c73ed04453d8c58d9e066e915641df31615cfe449b4ec5dd273f0f94f40",
    "reading_list_sha256":  "a5db9ef44414b457d8bec993538b1023800ed36bca7cd70c07ba64025fe243ac",
    "checklist_path":  "docs/project-management/modules/life-navigation/certification/IR-20260711-LIFE-APPLICATION-HISTORY-checklist.json",
    "checklist_sha256":  "87331e8b51385cd4a59b10d636176e4ab0e918b6d11acc1b55b1250b46c1d064",
    "responses":  [
                      {
                          "question_id":  "GQ-007",
                          "selected_option":  "A",
                          "correct":  true,
                          "source_path":  "AGENTS.md"
                      },
                      {
                          "question_id":  "GQ-006",
                          "selected_option":  "C",
                          "correct":  true,
                          "source_path":  "docs/project-management/ai-coding-incident-lessons-2026-07-10.md"
                      },
                      {
                          "question_id":  "GQ-011",
                          "selected_option":  "B",
                          "correct":  true,
                          "source_path":  "docs/project-management/module-internal-dependency-standard-v1.md"
                      },
                      {
                          "question_id":  "GQ-001",
                          "selected_option":  "B",
                          "correct":  true,
                          "source_path":  "CONSTRAINTS.md"
                      },
                      {
                          "question_id":  "GQ-003",
                          "selected_option":  "B",
                          "correct":  true,
                          "source_path":  "docs/decisions/0011-two-person-config-approval.md"
                      },
                      {
                          "question_id":  "GQ-002",
                          "selected_option":  "C",
                          "correct":  true,
                          "source_path":  "docs/decisions/0008-versioned-business-variables.md"
                      },
                      {
                          "question_id":  "GQ-010",
                          "selected_option":  "C",
                          "correct":  true,
                          "source_path":  "docs/decisions/0012-two-strike-root-cause-rule.md"
                      },
                      {
                          "question_id":  "GQ-008",
                          "selected_option":  "B",
                          "correct":  true,
                          "source_path":  "docs/decisions/0007-stable-foundation-variable-business.md"
                      }
                  ],
    "remediation_sources":  [

                            ]
}
