{
    "contract_version":  "governance-exam.v1",
    "attempt_id":  "EX-20260711-SECURE-MODULE-API-ACCEPTANCE-R3-1",
    "record_id":  "IR-20260711-SECURE-MODULE-API-ACCEPTANCE-R3",
    "actor":  "Codex platform integration agent",
    "attempt_number":  1,
    "status":  "passed",
    "generated_at":  "2026-07-10T20:22:44.4442794Z",
    "completed_at":  "2026-07-10T20:22:50.6447950Z",
    "question_count":  8,
    "passing_score":  100,
    "score":  100,
    "bank_sha256":  "215f1c73ed04453d8c58d9e066e915641df31615cfe449b4ec5dd273f0f94f40",
    "reading_list_sha256":  "a5db9ef44414b457d8bec993538b1023800ed36bca7cd70c07ba64025fe243ac",
    "checklist_path":  "contracts/foundation/development-checklists/2026-07-11-secure-module-api-acceptance-r3.json",
    "checklist_sha256":  "8f118fbae910bbb9e4aef31884d01cdee646c8fa011f5180eebcc81eaa741f52",
    "responses":  [
                      {
                          "question_id":  "GQ-002",
                          "selected_option":  "C",
                          "correct":  true,
                          "source_path":  "docs/decisions/0008-versioned-business-variables.md"
                      },
                      {
                          "question_id":  "GQ-006",
                          "selected_option":  "C",
                          "correct":  true,
                          "source_path":  "docs/project-management/ai-coding-incident-lessons-2026-07-10.md"
                      },
                      {
                          "question_id":  "GQ-014",
                          "selected_option":  "C",
                          "correct":  true,
                          "source_path":  "contracts/foundation/recurring-issues.v1.json"
                      },
                      {
                          "question_id":  "GQ-013",
                          "selected_option":  "B",
                          "correct":  true,
                          "source_path":  "docs/decisions/0014-ai-development-flight-checklist.md"
                      },
                      {
                          "question_id":  "GQ-001",
                          "selected_option":  "B",
                          "correct":  true,
                          "source_path":  "CONSTRAINTS.md"
                      },
                      {
                          "question_id":  "GQ-003",
                          "selected_option":  "B",
                          "correct":  true,
                          "source_path":  "docs/decisions/0011-two-person-config-approval.md"
                      },
                      {
                          "question_id":  "GQ-015",
                          "selected_option":  "B",
                          "correct":  true,
                          "source_path":  "contracts/foundation/engineering-standards.v1.json"
                      },
                      {
                          "question_id":  "GQ-009",
                          "selected_option":  "B",
                          "correct":  true,
                          "source_path":  "docs/decisions/0010-ai-implementation-records-required.md"
                      }
                  ],
    "remediation_sources":  [

                            ]
}
