{
    "contract_version":  "governance-exam.v1",
    "attempt_id":  "EX-20260712-HEALTH-MVP90-M1-READINESS-DISPATCH-R3-1",
    "record_id":  "IR-20260712-HEALTH-MVP90-M1-READINESS-DISPATCH-R3",
    "actor":  "Codex platform integration agent",
    "attempt_number":  1,
    "status":  "passed",
    "generated_at":  "2026-07-12T04:21:46.8779398Z",
    "completed_at":  "2026-07-12T04:21:55.3162550Z",
    "question_count":  8,
    "passing_score":  100,
    "score":  100,
    "bank_sha256":  "215f1c73ed04453d8c58d9e066e915641df31615cfe449b4ec5dd273f0f94f40",
    "reading_list_sha256":  "a5db9ef44414b457d8bec993538b1023800ed36bca7cd70c07ba64025fe243ac",
    "checklist_path":  "contracts/foundation/development-checklists/2026-07-12-health-mvp90-m1-readiness-dispatch-r3.json",
    "checklist_sha256":  "89b88798e77d439193bbdd0df4de07c8bb10b74be72eaa6e2f98a6bda6092055",
    "responses":  [
                      {
                          "question_id":  "GQ-008",
                          "selected_option":  "B",
                          "correct":  true,
                          "source_path":  "docs/decisions/0007-stable-foundation-variable-business.md"
                      },
                      {
                          "question_id":  "GQ-011",
                          "selected_option":  "B",
                          "correct":  true,
                          "source_path":  "docs/project-management/module-internal-dependency-standard-v1.md"
                      },
                      {
                          "question_id":  "GQ-015",
                          "selected_option":  "B",
                          "correct":  true,
                          "source_path":  "contracts/foundation/engineering-standards.v1.json"
                      },
                      {
                          "question_id":  "GQ-001",
                          "selected_option":  "B",
                          "correct":  true,
                          "source_path":  "CONSTRAINTS.md"
                      },
                      {
                          "question_id":  "GQ-005",
                          "selected_option":  "B",
                          "correct":  true,
                          "source_path":  "docs/decisions/0015-isolated-agent-work-and-controlled-integration.md"
                      },
                      {
                          "question_id":  "GQ-004",
                          "selected_option":  "B",
                          "correct":  true,
                          "source_path":  "docs/decisions/0016-ai-agent-authority-and-untrusted-context.md"
                      },
                      {
                          "question_id":  "GQ-010",
                          "selected_option":  "C",
                          "correct":  true,
                          "source_path":  "docs/decisions/0012-two-strike-root-cause-rule.md"
                      },
                      {
                          "question_id":  "GQ-002",
                          "selected_option":  "C",
                          "correct":  true,
                          "source_path":  "docs/decisions/0008-versioned-business-variables.md"
                      }
                  ],
    "remediation_sources":  [

                            ]
}
