{
    "contract_version":  "governance-exam.v1",
    "attempt_id":  "EX-20260711-SECURE-MODULE-API-ACCEPTANCE-R2-1",
    "record_id":  "IR-20260711-SECURE-MODULE-API-ACCEPTANCE-R2",
    "actor":  "Codex platform integration agent",
    "attempt_number":  1,
    "status":  "passed",
    "generated_at":  "2026-07-10T20:20:51.5645462Z",
    "completed_at":  "2026-07-10T20:20:57.9173942Z",
    "question_count":  8,
    "passing_score":  100,
    "score":  100,
    "bank_sha256":  "215f1c73ed04453d8c58d9e066e915641df31615cfe449b4ec5dd273f0f94f40",
    "reading_list_sha256":  "a5db9ef44414b457d8bec993538b1023800ed36bca7cd70c07ba64025fe243ac",
    "checklist_path":  "contracts/foundation/development-checklists/2026-07-11-secure-module-api-acceptance-r2.json",
    "checklist_sha256":  "5373e866b3e18eb26b1a152990b1fff49eb29a5a8fd2029e4585102579585d24",
    "responses":  [
                      {
                          "question_id":  "GQ-005",
                          "selected_option":  "B",
                          "correct":  true,
                          "source_path":  "docs/decisions/0015-isolated-agent-work-and-controlled-integration.md"
                      },
                      {
                          "question_id":  "GQ-012",
                          "selected_option":  "B",
                          "correct":  true,
                          "source_path":  "contracts/foundation/agent-collaboration.v1.json"
                      },
                      {
                          "question_id":  "GQ-013",
                          "selected_option":  "B",
                          "correct":  true,
                          "source_path":  "docs/decisions/0014-ai-development-flight-checklist.md"
                      },
                      {
                          "question_id":  "GQ-016",
                          "selected_option":  "B",
                          "correct":  true,
                          "source_path":  "docs/decisions/0013-mandatory-ai-development-entrypoint.md"
                      },
                      {
                          "question_id":  "GQ-007",
                          "selected_option":  "A",
                          "correct":  true,
                          "source_path":  "AGENTS.md"
                      },
                      {
                          "question_id":  "GQ-004",
                          "selected_option":  "B",
                          "correct":  true,
                          "source_path":  "docs/decisions/0016-ai-agent-authority-and-untrusted-context.md"
                      },
                      {
                          "question_id":  "GQ-008",
                          "selected_option":  "B",
                          "correct":  true,
                          "source_path":  "docs/decisions/0007-stable-foundation-variable-business.md"
                      },
                      {
                          "question_id":  "GQ-002",
                          "selected_option":  "C",
                          "correct":  true,
                          "source_path":  "docs/decisions/0008-versioned-business-variables.md"
                      }
                  ],
    "remediation_sources":  [

                            ]
}
