{
    "contract_version":  "governance-exam.v1",
    "attempt_id":  "EX-20260715-PLATFORM-REGISTRY-R12N-R2-APPLICATION-ACTIVATION-1",
    "record_id":  "IR-20260715-PLATFORM-REGISTRY-R12N-R2-APPLICATION-ACTIVATION",
    "actor":  "平台注册表R12-N-R2实施负责人",
    "attempt_number":  1,
    "status":  "passed",
    "generated_at":  "2026-07-15T13:48:38.3856416Z",
    "completed_at":  "2026-07-15T13:48:46.6136551Z",
    "question_count":  8,
    "passing_score":  100,
    "score":  100,
    "bank_sha256":  "215f1c73ed04453d8c58d9e066e915641df31615cfe449b4ec5dd273f0f94f40",
    "reading_list_sha256":  "6f83e140d1e55fe35d1520c13eed55717a812bb21464c59441947c05d7f3b9a6",
    "checklist_path":  "contracts/foundation/development-checklists/2026-07-15-platform-registry-r12n-r2-application-activation.json",
    "checklist_sha256":  "c046dc3e034f1bc8d60d60fc186886944bf03e00a0d4e8745ed3579bc8d98afc",
    "responses":  [
                      {
                          "question_id":  "GQ-011",
                          "selected_option":  "B",
                          "correct":  true,
                          "source_path":  "docs/project-management/module-internal-dependency-standard-v1.md"
                      },
                      {
                          "question_id":  "GQ-003",
                          "selected_option":  "B",
                          "correct":  true,
                          "source_path":  "docs/decisions/0011-two-person-config-approval.md"
                      },
                      {
                          "question_id":  "GQ-008",
                          "selected_option":  "B",
                          "correct":  true,
                          "source_path":  "docs/decisions/0007-stable-foundation-variable-business.md"
                      },
                      {
                          "question_id":  "GQ-007",
                          "selected_option":  "A",
                          "correct":  true,
                          "source_path":  "AGENTS.md"
                      },
                      {
                          "question_id":  "GQ-005",
                          "selected_option":  "B",
                          "correct":  true,
                          "source_path":  "docs/decisions/0015-isolated-agent-work-and-controlled-integration.md"
                      },
                      {
                          "question_id":  "GQ-012",
                          "selected_option":  "B",
                          "correct":  true,
                          "source_path":  "contracts/foundation/agent-collaboration.v1.json"
                      },
                      {
                          "question_id":  "GQ-004",
                          "selected_option":  "B",
                          "correct":  true,
                          "source_path":  "docs/decisions/0016-ai-agent-authority-and-untrusted-context.md"
                      },
                      {
                          "question_id":  "GQ-002",
                          "selected_option":  "C",
                          "correct":  true,
                          "source_path":  "docs/decisions/0008-versioned-business-variables.md"
                      }
                  ],
    "remediation_sources":  [

                            ]
}
