{
    "contract_version":  "governance-exam.v1",
    "attempt_id":  "EX-20260713-HEALTH-R0-F2-FRESH-01-1",
    "record_id":  "IR-20260713-HEALTH-R0-F2-FRESH-01",
    "actor":  "Health Manager module agent",
    "attempt_number":  1,
    "status":  "passed",
    "generated_at":  "2026-07-12T23:00:51.1925475Z",
    "completed_at":  "2026-07-12T23:01:14.5928528Z",
    "question_count":  8,
    "passing_score":  100,
    "score":  100,
    "bank_sha256":  "215f1c73ed04453d8c58d9e066e915641df31615cfe449b4ec5dd273f0f94f40",
    "reading_list_sha256":  "a5db9ef44414b457d8bec993538b1023800ed36bca7cd70c07ba64025fe243ac",
    "checklist_path":  "contracts/modules/health-manager/development-checklists/2026-07-13-health-r0-f2-audit-freshness-r2.json",
    "checklist_sha256":  "be903ccdf54af1c9d915a300b9def15ee30f14720ca25c9a9679acd2f3ba259f",
    "responses":  [
                      {
                          "question_id":  "GQ-016",
                          "selected_option":  "B",
                          "correct":  true,
                          "source_path":  "docs/decisions/0013-mandatory-ai-development-entrypoint.md"
                      },
                      {
                          "question_id":  "GQ-010",
                          "selected_option":  "C",
                          "correct":  true,
                          "source_path":  "docs/decisions/0012-two-strike-root-cause-rule.md"
                      },
                      {
                          "question_id":  "GQ-012",
                          "selected_option":  "B",
                          "correct":  true,
                          "source_path":  "contracts/foundation/agent-collaboration.v1.json"
                      },
                      {
                          "question_id":  "GQ-014",
                          "selected_option":  "C",
                          "correct":  true,
                          "source_path":  "contracts/foundation/recurring-issues.v1.json"
                      },
                      {
                          "question_id":  "GQ-002",
                          "selected_option":  "C",
                          "correct":  true,
                          "source_path":  "docs/decisions/0008-versioned-business-variables.md"
                      },
                      {
                          "question_id":  "GQ-001",
                          "selected_option":  "B",
                          "correct":  true,
                          "source_path":  "CONSTRAINTS.md"
                      },
                      {
                          "question_id":  "GQ-011",
                          "selected_option":  "B",
                          "correct":  true,
                          "source_path":  "docs/project-management/module-internal-dependency-standard-v1.md"
                      },
                      {
                          "question_id":  "GQ-013",
                          "selected_option":  "B",
                          "correct":  true,
                          "source_path":  "docs/decisions/0014-ai-development-flight-checklist.md"
                      }
                  ],
    "remediation_sources":  [

                            ]
}
