{
    "contract_version":  "governance-exam.v1",
    "attempt_id":  "EX-20260712-HEALTH-MVP90-M1-P2-C3-R2-1",
    "record_id":  "IR-20260712-HEALTH-MVP90-M1-P2-C3-R2",
    "actor":  "健康大管家负责人",
    "attempt_number":  1,
    "status":  "passed",
    "generated_at":  "2026-07-12T11:06:22.3485856Z",
    "completed_at":  "2026-07-12T11:06:29.8794433Z",
    "question_count":  8,
    "passing_score":  100,
    "score":  100,
    "bank_sha256":  "215f1c73ed04453d8c58d9e066e915641df31615cfe449b4ec5dd273f0f94f40",
    "reading_list_sha256":  "a5db9ef44414b457d8bec993538b1023800ed36bca7cd70c07ba64025fe243ac",
    "checklist_path":  "contracts/modules/health-manager/development-checklists/2026-07-12-health-mvp90-m1-p2-c3-r2.json",
    "checklist_sha256":  "38ea55c68276a9eaf9d25caddff9fec92dfc770119fcd6107d5f6b79c4408c84",
    "responses":  [
                      {
                          "question_id":  "GQ-005",
                          "selected_option":  "B",
                          "correct":  true,
                          "source_path":  "docs/decisions/0015-isolated-agent-work-and-controlled-integration.md"
                      },
                      {
                          "question_id":  "GQ-006",
                          "selected_option":  "C",
                          "correct":  true,
                          "source_path":  "docs/project-management/ai-coding-incident-lessons-2026-07-10.md"
                      },
                      {
                          "question_id":  "GQ-002",
                          "selected_option":  "C",
                          "correct":  true,
                          "source_path":  "docs/decisions/0008-versioned-business-variables.md"
                      },
                      {
                          "question_id":  "GQ-009",
                          "selected_option":  "B",
                          "correct":  true,
                          "source_path":  "docs/decisions/0010-ai-implementation-records-required.md"
                      },
                      {
                          "question_id":  "GQ-016",
                          "selected_option":  "B",
                          "correct":  true,
                          "source_path":  "docs/decisions/0013-mandatory-ai-development-entrypoint.md"
                      },
                      {
                          "question_id":  "GQ-012",
                          "selected_option":  "B",
                          "correct":  true,
                          "source_path":  "contracts/foundation/agent-collaboration.v1.json"
                      },
                      {
                          "question_id":  "GQ-004",
                          "selected_option":  "B",
                          "correct":  true,
                          "source_path":  "docs/decisions/0016-ai-agent-authority-and-untrusted-context.md"
                      },
                      {
                          "question_id":  "GQ-010",
                          "selected_option":  "C",
                          "correct":  true,
                          "source_path":  "docs/decisions/0012-two-strike-root-cause-rule.md"
                      }
                  ],
    "remediation_sources":  [

                            ]
}
