{
    "contract_version":  "governance-exam.v1",
    "attempt_id":  "EX-20260711-CLUB-ALLIANCE-F0-H0-M0-1",
    "record_id":  "IR-20260711-CLUB-ALLIANCE-F0-H0-M0",
    "actor":  "Club Alliance module agent",
    "attempt_number":  1,
    "status":  "passed",
    "generated_at":  "2026-07-10T23:01:54.7441837Z",
    "completed_at":  "2026-07-10T23:02:35.6690633Z",
    "question_count":  8,
    "passing_score":  100,
    "score":  100,
    "bank_sha256":  "215f1c73ed04453d8c58d9e066e915641df31615cfe449b4ec5dd273f0f94f40",
    "reading_list_sha256":  "a5db9ef44414b457d8bec993538b1023800ed36bca7cd70c07ba64025fe243ac",
    "checklist_path":  "contracts/modules/club-alliance/development-checklists/2026-07-11-club-alliance-f0-h0-m0.json",
    "checklist_sha256":  "5b3b8ed80a0cd846909d797f6cdb7e238daf0391c1d5c70d1a5c7d4a9134aadf",
    "responses":  [
                      {
                          "question_id":  "GQ-004",
                          "selected_option":  "B",
                          "correct":  true,
                          "source_path":  "docs/decisions/0016-ai-agent-authority-and-untrusted-context.md"
                      },
                      {
                          "question_id":  "GQ-009",
                          "selected_option":  "B",
                          "correct":  true,
                          "source_path":  "docs/decisions/0010-ai-implementation-records-required.md"
                      },
                      {
                          "question_id":  "GQ-016",
                          "selected_option":  "B",
                          "correct":  true,
                          "source_path":  "docs/decisions/0013-mandatory-ai-development-entrypoint.md"
                      },
                      {
                          "question_id":  "GQ-008",
                          "selected_option":  "B",
                          "correct":  true,
                          "source_path":  "docs/decisions/0007-stable-foundation-variable-business.md"
                      },
                      {
                          "question_id":  "GQ-012",
                          "selected_option":  "B",
                          "correct":  true,
                          "source_path":  "contracts/foundation/agent-collaboration.v1.json"
                      },
                      {
                          "question_id":  "GQ-002",
                          "selected_option":  "C",
                          "correct":  true,
                          "source_path":  "docs/decisions/0008-versioned-business-variables.md"
                      },
                      {
                          "question_id":  "GQ-001",
                          "selected_option":  "B",
                          "correct":  true,
                          "source_path":  "CONSTRAINTS.md"
                      },
                      {
                          "question_id":  "GQ-007",
                          "selected_option":  "A",
                          "correct":  true,
                          "source_path":  "AGENTS.md"
                      }
                  ],
    "remediation_sources":  [

                            ]
}
