{
    "contract_version":  "governance-exam.v1",
    "attempt_id":  "EX-20260715-CLUB-PUBLIC-WELFARE-REGIONAL-C1-1",
    "record_id":  "IR-20260715-CLUB-PUBLIC-WELFARE-REGIONAL-C1",
    "actor":  "Club Alliance public-welfare and regional-center agent",
    "attempt_number":  1,
    "status":  "passed",
    "generated_at":  "2026-07-15T11:32:11.7410145Z",
    "completed_at":  "2026-07-15T11:32:18.2943688Z",
    "question_count":  8,
    "passing_score":  100,
    "score":  100,
    "bank_sha256":  "215f1c73ed04453d8c58d9e066e915641df31615cfe449b4ec5dd273f0f94f40",
    "reading_list_sha256":  "b0df386a68e8e00a803a08d0b3e786893a47bad6742dd36a5b6273803b7abcb1",
    "checklist_path":  "contracts/modules/club-alliance/development-checklists/2026-07-15-club-public-welfare-regional-c1-r2.json",
    "checklist_sha256":  "0c843a36df91c7235004de08857c407c7ce9487ceba2a19069fd78344555ceef",
    "responses":  [
                      {
                          "question_id":  "GQ-012",
                          "selected_option":  "B",
                          "correct":  true,
                          "source_path":  "contracts/foundation/agent-collaboration.v1.json"
                      },
                      {
                          "question_id":  "GQ-008",
                          "selected_option":  "B",
                          "correct":  true,
                          "source_path":  "docs/decisions/0007-stable-foundation-variable-business.md"
                      },
                      {
                          "question_id":  "GQ-014",
                          "selected_option":  "C",
                          "correct":  true,
                          "source_path":  "contracts/foundation/recurring-issues.v1.json"
                      },
                      {
                          "question_id":  "GQ-011",
                          "selected_option":  "B",
                          "correct":  true,
                          "source_path":  "docs/project-management/module-internal-dependency-standard-v1.md"
                      },
                      {
                          "question_id":  "GQ-009",
                          "selected_option":  "B",
                          "correct":  true,
                          "source_path":  "docs/decisions/0010-ai-implementation-records-required.md"
                      },
                      {
                          "question_id":  "GQ-013",
                          "selected_option":  "B",
                          "correct":  true,
                          "source_path":  "docs/decisions/0014-ai-development-flight-checklist.md"
                      },
                      {
                          "question_id":  "GQ-001",
                          "selected_option":  "B",
                          "correct":  true,
                          "source_path":  "CONSTRAINTS.md"
                      },
                      {
                          "question_id":  "GQ-016",
                          "selected_option":  "B",
                          "correct":  true,
                          "source_path":  "docs/decisions/0013-mandatory-ai-development-entrypoint.md"
                      }
                  ],
    "remediation_sources":  [

                            ]
}
