{
    "contract_version":  "governance-exam.v1",
    "attempt_id":  "EX-20260713-HEALTH-R1-C1-ACCEPTANCE-1",
    "record_id":  "IR-20260713-HEALTH-R1-C1-ACCEPTANCE",
    "actor":  "Codex platform integration agent",
    "attempt_number":  1,
    "status":  "passed",
    "generated_at":  "2026-07-13T13:52:15.8669783Z",
    "completed_at":  "2026-07-13T13:52:26.1390790Z",
    "question_count":  8,
    "passing_score":  100,
    "score":  100,
    "bank_sha256":  "215f1c73ed04453d8c58d9e066e915641df31615cfe449b4ec5dd273f0f94f40",
    "reading_list_sha256":  "b0df386a68e8e00a803a08d0b3e786893a47bad6742dd36a5b6273803b7abcb1",
    "checklist_path":  "contracts/foundation/development-checklists/2026-07-13-health-r1-c1-acceptance.json",
    "checklist_sha256":  "92b56e0b6d566f9ec564ac34e8576072c126c667c8838ccbb64d451578291048",
    "responses":  [
                      {
                          "question_id":  "GQ-006",
                          "selected_option":  "C",
                          "correct":  true,
                          "source_path":  "docs/project-management/ai-coding-incident-lessons-2026-07-10.md"
                      },
                      {
                          "question_id":  "GQ-002",
                          "selected_option":  "C",
                          "correct":  true,
                          "source_path":  "docs/decisions/0008-versioned-business-variables.md"
                      },
                      {
                          "question_id":  "GQ-008",
                          "selected_option":  "B",
                          "correct":  true,
                          "source_path":  "docs/decisions/0007-stable-foundation-variable-business.md"
                      },
                      {
                          "question_id":  "GQ-011",
                          "selected_option":  "B",
                          "correct":  true,
                          "source_path":  "docs/project-management/module-internal-dependency-standard-v1.md"
                      },
                      {
                          "question_id":  "GQ-004",
                          "selected_option":  "B",
                          "correct":  true,
                          "source_path":  "docs/decisions/0016-ai-agent-authority-and-untrusted-context.md"
                      },
                      {
                          "question_id":  "GQ-015",
                          "selected_option":  "B",
                          "correct":  true,
                          "source_path":  "contracts/foundation/engineering-standards.v1.json"
                      },
                      {
                          "question_id":  "GQ-003",
                          "selected_option":  "B",
                          "correct":  true,
                          "source_path":  "docs/decisions/0011-two-person-config-approval.md"
                      },
                      {
                          "question_id":  "GQ-014",
                          "selected_option":  "C",
                          "correct":  true,
                          "source_path":  "contracts/foundation/recurring-issues.v1.json"
                      }
                  ],
    "remediation_sources":  [

                            ]
}
