{
  "contract_version": "governance-exam.v1",
  "attempt_id": "EX-20260728-PLATFORM-ACTIVITY-ONLY-LIFECYCLE-MIGRATION-R1-1",
  "record_id": "IR-20260728-PLATFORM-ACTIVITY-ONLY-LIFECYCLE-MIGRATION-R1",
  "actor": "platform registry owner",
  "attempt_number": 1,
  "status": "passed",
  "generated_at": "2026-07-28T04:46:14.0192875Z",
  "completed_at": "2026-07-28T04:46:37.9160692Z",
  "question_count": 8,
  "passing_score": 100,
  "score": 100,
  "bank_sha256": "215f1c73ed04453d8c58d9e066e915641df31615cfe449b4ec5dd273f0f94f40",
  "reading_list_sha256": "6f83e140d1e55fe35d1520c13eed55717a812bb21464c59441947c05d7f3b9a6",
  "checklist_path": "contracts/foundation/development-checklists/2026-07-28-platform-activity-only-lifecycle-migration-r1.json",
  "checklist_sha256": "a6544ea815393e2bc2de84390e2b5fed98af2f4f87d4b4a1df3288e0029fa165",
  "responses": [
    {
      "question_id": "GQ-008",
      "selected_option": "B",
      "correct": true,
      "source_path": "docs/decisions/0007-stable-foundation-variable-business.md"
    },
    {
      "question_id": "GQ-009",
      "selected_option": "B",
      "correct": true,
      "source_path": "docs/decisions/0010-ai-implementation-records-required.md"
    },
    {
      "question_id": "GQ-010",
      "selected_option": "C",
      "correct": true,
      "source_path": "docs/decisions/0012-two-strike-root-cause-rule.md"
    },
    {
      "question_id": "GQ-014",
      "selected_option": "C",
      "correct": true,
      "source_path": "contracts/foundation/recurring-issues.v1.json"
    },
    {
      "question_id": "GQ-003",
      "selected_option": "B",
      "correct": true,
      "source_path": "docs/decisions/0011-two-person-config-approval.md"
    },
    {
      "question_id": "GQ-004",
      "selected_option": "B",
      "correct": true,
      "source_path": "docs/decisions/0016-ai-agent-authority-and-untrusted-context.md"
    },
    {
      "question_id": "GQ-001",
      "selected_option": "B",
      "correct": true,
      "source_path": "CONSTRAINTS.md"
    },
    {
      "question_id": "GQ-013",
      "selected_option": "B",
      "correct": true,
      "source_path": "docs/decisions/0014-ai-development-flight-checklist.md"
    }
  ],
  "remediation_sources": []
}
