{
    "contract_version":  "governance-exam.v1",
    "attempt_id":  "EX-20260714-HEALTH-R4-C1-ACCEPTANCE-R2-1",
    "record_id":  "IR-20260714-HEALTH-R4-C1-ACCEPTANCE-R2",
    "actor":  "Codex platform integration agent",
    "attempt_number":  1,
    "status":  "passed",
    "generated_at":  "2026-07-13T20:02:24.5764253Z",
    "completed_at":  "2026-07-13T20:02:30.5051337Z",
    "question_count":  8,
    "passing_score":  100,
    "score":  100,
    "bank_sha256":  "215f1c73ed04453d8c58d9e066e915641df31615cfe449b4ec5dd273f0f94f40",
    "reading_list_sha256":  "b0df386a68e8e00a803a08d0b3e786893a47bad6742dd36a5b6273803b7abcb1",
    "checklist_path":  "contracts/foundation/development-checklists/2026-07-14-health-r4-c1-acceptance-r2.json",
    "checklist_sha256":  "e88a68c1cd0646c9cf81012dec530e1cb90c41b0d959884a7fc21882927eeb12",
    "responses":  [
                      {
                          "question_id":  "GQ-014",
                          "selected_option":  "C",
                          "correct":  true,
                          "source_path":  "contracts/foundation/recurring-issues.v1.json"
                      },
                      {
                          "question_id":  "GQ-008",
                          "selected_option":  "B",
                          "correct":  true,
                          "source_path":  "docs/decisions/0007-stable-foundation-variable-business.md"
                      },
                      {
                          "question_id":  "GQ-010",
                          "selected_option":  "C",
                          "correct":  true,
                          "source_path":  "docs/decisions/0012-two-strike-root-cause-rule.md"
                      },
                      {
                          "question_id":  "GQ-002",
                          "selected_option":  "C",
                          "correct":  true,
                          "source_path":  "docs/decisions/0008-versioned-business-variables.md"
                      },
                      {
                          "question_id":  "GQ-011",
                          "selected_option":  "B",
                          "correct":  true,
                          "source_path":  "docs/project-management/module-internal-dependency-standard-v1.md"
                      },
                      {
                          "question_id":  "GQ-015",
                          "selected_option":  "B",
                          "correct":  true,
                          "source_path":  "contracts/foundation/engineering-standards.v1.json"
                      },
                      {
                          "question_id":  "GQ-001",
                          "selected_option":  "B",
                          "correct":  true,
                          "source_path":  "CONSTRAINTS.md"
                      },
                      {
                          "question_id":  "GQ-007",
                          "selected_option":  "A",
                          "correct":  true,
                          "source_path":  "AGENTS.md"
                      }
                  ],
    "remediation_sources":  [

                            ]
}
